{
  "grammar_id": "risk-grid-with-mitigation-notes",
  "summary": "A risk structure that keeps each risk visibly paired with its mitigation and optional ownership.",
  "fits_classes": [
    "risk-mitigation",
    "sensitivity-scenario",
    "owner-governance"
  ],
  "not_for": [
    "customer-journey",
    "market-sizing",
    "strategy-pillars"
  ],
  "common_decision_types": [
    "de-risk",
    "compare"
  ],
  "common_data_shapes": [
    "matrix",
    "table",
    "comparison"
  ],
  "dominance_structure": "distributed",
  "required_blocks": [
    "risk category or matrix",
    "impact or severity signal",
    "paired mitigation notes"
  ],
  "optional_blocks": [
    "owner markers",
    "timing markers"
  ],
  "allowed_visual_devices": [
    "risk-mitigation-table",
    "risk-matrix",
    "callout-card",
    "decision-tree"
  ],
  "reading_order": [
    "risk",
    "impact",
    "mitigation"
  ],
  "usage_notes": [
    "Use when the audience must understand both the downside and the response on the same page.",
    "Keep risks concise and mitigation action-oriented."
  ],
  "avoid_notes": [
    "Do not use this grammar for generic summary pages with no clear risk-response pairing."
  ]
}
